<?xml version="1.0" encoding="UTF-8"?>
<!ELEMENT list (entry)+>
<!ELEMENT entry (firstname, lastname, email)>
<!ELEMENT firstname (#PCDATA)>
<!ELEMENT lastname (#PCDATA)>
<!ELEMENT email (#PCDATA)>
